{
  "$schema": "docs/schemas/ethercat-feature-locator-v1.schema.json",
  "format": "embed-labs-ethercat-feature-locator-v1",
  "formatVersion": 1,
  "areas": [
    {"id": "architecture", "titleZh": "架构与公共合同"},
    {"id": "project", "titleZh": "工程模型"},
    {"id": "devices", "titleZh": "设备、ESI 与 Adapter"},
    {"id": "online", "titleZh": "真实控制器在线功能"},
    {"id": "compiler", "titleZh": "编译与准备"},
    {"id": "runtime", "titleZh": "签名运行时与控制"},
    {"id": "ui", "titleZh": "Workbench 界面"},
    {"id": "mock", "titleZh": "Mock 工具"},
    {"id": "automation", "titleZh": "自动化网关"}
  ],
  "components": [
    {
      "id": "ethercat-data",
      "target": "EtherCATData",
      "directory": "src/libs/ethercatdata",
      "cmake": "src/libs/ethercatdata/CMakeLists.txt",
      "qbs": "src/libs/ethercatdata/ethercatdata.qbs",
      "dependsOn": [],
      "responsibilityZh": "跨插件共享的不可变值类型、枚举、稳定标识和数据合同。"
    },
    {
      "id": "ethercat-core",
      "target": "EtherCATCore",
      "directory": "src/plugins/ethercatcore",
      "cmake": "src/plugins/ethercatcore/CMakeLists.txt",
      "qbs": "src/plugins/ethercatcore/ethercatcore.qbs",
      "metadata": "src/plugins/ethercatcore/EtherCATCore.json.in",
      "dependsOn": ["ethercat-data"],
      "responsibilityZh": "Provider 注册、公共服务接口、状态与选择等扩展边界。"
    },
    {
      "id": "ethercat-project",
      "target": "EtherCATProject",
      "directory": "src/plugins/ethercatproject",
      "cmake": "src/plugins/ethercatproject/CMakeLists.txt",
      "qbs": "src/plugins/ethercatproject/ethercatproject.qbs",
      "metadata": "src/plugins/ethercatproject/EtherCATProject.json.in",
      "dependsOn": ["ethercat-data", "ethercat-core"],
      "responsibilityZh": "工程格式、迁移、持久化、Undo/Redo 和工程变更服务。"
    },
    {
      "id": "ethercat-devices",
      "target": "EtherCATDevices",
      "directory": "src/plugins/ethercatdevices",
      "cmake": "src/plugins/ethercatdevices/CMakeLists.txt",
      "qbs": "src/plugins/ethercatdevices/ethercatdevices.qbs",
      "metadata": "src/plugins/ethercatdevices/EtherCATDevices.json.in",
      "dependsOn": ["ethercat-data", "ethercat-core"],
      "responsibilityZh": "ESI XML 解析、固定设备库、导入和设备描述索引。"
    },
    {
      "id": "ethercat-device-adapters",
      "target": "EtherCATDeviceAdapters",
      "directory": "src/plugins/ethercatdeviceadapters",
      "cmake": "src/plugins/ethercatdeviceadapters/CMakeLists.txt",
      "qbs": "src/plugins/ethercatdeviceadapters/ethercatdeviceadapters.qbs",
      "metadata": "src/plugins/ethercatdeviceadapters/EtherCATDeviceAdapters.json.in",
      "dependsOn": ["ethercat-data", "ethercat-core"],
      "responsibilityZh": "厂家无关 Adapter 目录、精确型号匹配、授权和信任校验。"
    },
    {
      "id": "ethercat-product-api",
      "target": "EtherCATProductApi",
      "directory": "src/plugins/ethercatproductapi",
      "cmake": "src/plugins/ethercatproductapi/CMakeLists.txt",
      "qbs": "src/plugins/ethercatproductapi/ethercatproductapi.qbs",
      "metadata": "src/plugins/ethercatproductapi/EtherCATProductApi.json.in",
      "dependsOn": ["ethercat-data", "ethercat-core"],
      "responsibilityZh": "Embed Labs 控制器三通道 Product API、会话、协议和在线 Provider。"
    },
    {
      "id": "ethercat-project-compiler",
      "target": "EtherCATProjectCompiler",
      "directory": "src/plugins/ethercatprojectcompiler",
      "cmake": "src/plugins/ethercatprojectcompiler/CMakeLists.txt",
      "qbs": "src/plugins/ethercatprojectcompiler/ethercatprojectcompiler.qbs",
      "metadata": "src/plugins/ethercatprojectcompiler/EtherCATProjectCompiler.json.in",
      "dependsOn": ["ethercat-data", "ethercat-core"],
      "responsibilityZh": "工程快照投影、外部编译器调用、幂等账本和准备事务。"
    },
    {
      "id": "ethercat-semantic-runtime",
      "target": "EtherCATSemanticRuntime",
      "directory": "src/plugins/ethercatsemanticruntime",
      "cmake": "src/plugins/ethercatsemanticruntime/CMakeLists.txt",
      "qbs": "src/plugins/ethercatsemanticruntime/ethercatsemanticruntime.qbs",
      "metadata": "src/plugins/ethercatsemanticruntime/EtherCATSemanticRuntime.json.in",
      "dependsOn": ["ethercat-data", "ethercat-core", "ethercat-project", "ethercat-project-compiler"],
      "responsibilityZh": "签名 ECPKG 证据、语义绑定、动作执行和激活事务。"
    },
    {
      "id": "ethercat-workbench",
      "target": "EtherCATWorkbench",
      "directory": "src/plugins/ethercatworkbench",
      "cmake": "src/plugins/ethercatworkbench/CMakeLists.txt",
      "qbs": "src/plugins/ethercatworkbench/ethercatworkbench.qbs",
      "metadata": "src/plugins/ethercatworkbench/EtherCATWorkbench.json.in",
      "dependsOn": ["ethercat-data", "ethercat-core", "ethercat-devices", "ethercat-project", "ethercat-project-compiler", "ethercat-semantic-runtime"],
      "responsibilityZh": "统一工程树、命令、属性页、在线状态和应用程序输出。"
    },
    {
      "id": "ethercat-scan",
      "target": "EtherCATScan",
      "directory": "src/plugins/ethercatscan",
      "cmake": "src/plugins/ethercatscan/CMakeLists.txt",
      "qbs": "src/plugins/ethercatscan/ethercatscan.qbs",
      "metadata": "src/plugins/ethercatscan/EtherCATScan.json.in",
      "dependsOn": ["ethercat-data", "ethercat-core", "ethercat-devices", "ethercat-project", "ethercat-workbench"],
      "responsibilityZh": "仅 Mock 的扫描、拓扑比较和接受到离线工程流程。"
    },
    {
      "id": "ethercat-diagnostics",
      "target": "EtherCATDiagnostics",
      "directory": "src/plugins/ethercatdiagnostics",
      "cmake": "src/plugins/ethercatdiagnostics/CMakeLists.txt",
      "qbs": "src/plugins/ethercatdiagnostics/ethercatdiagnostics.qbs",
      "metadata": "src/plugins/ethercatdiagnostics/EtherCATDiagnostics.json.in",
      "dependsOn": ["ethercat-data", "ethercat-core", "ethercat-project", "ethercat-workbench"],
      "responsibilityZh": "仅 Mock 的诊断采样、告警生命周期和诊断属性页。"
    },
    {
      "id": "ethercat-automation-gateway",
      "target": "EtherCATAutomationGateway",
      "directory": "src/plugins/ethercatautomationgateway",
      "cmake": "src/plugins/ethercatautomationgateway/CMakeLists.txt",
      "qbs": "src/plugins/ethercatautomationgateway/ethercatautomationgateway.qbs",
      "metadata": "src/plugins/ethercatautomationgateway/EtherCATAutomationGateway.json.in",
      "dependsOn": ["ethercat-data", "ethercat-core", "ethercat-semantic-runtime", "ethercat-workbench"],
      "responsibilityZh": "默认关闭且仅回环绑定的 MCP/REST 自动化入口。"
    }
  ],
  "features": [
    {
      "id": "ethercat.data.domain-contracts",
      "area": "architecture",
      "titleZh": "跨插件数据合同",
      "summaryZh": "定义工程、控制器、资源、输出事务和语义运行时共享值类型。",
      "owner": "ethercat-data",
      "runtimeBoundary": "contract-only",
      "evidenceBoundary": ["unit"],
      "keywords": ["公共数据", "值类型", "NodeId", "ControllerConnection", "资源"],
      "implementation": [
        {"path": "src/libs/ethercatdata/offlineconfiguration.cpp", "symbols": ["validateProcessDataConfiguration"], "roleZh": "离线配置值合同校验"}
      ],
      "contracts": [
        {"path": "src/libs/ethercatdata/controllerconnection.h", "symbols": ["ControllerConnectionSnapshot", "ControllerControlRequest"], "roleZh": "控制器在线共享合同"},
        {"path": "src/libs/ethercatdata/projectsnapshot.h", "symbols": ["ProjectSnapshot"], "roleZh": "工程快照合同"}
      ],
      "tests": [
        {"path": "src/plugins/ethercatcore/ethercatcoretests.cpp", "cases": ["testProjectSnapshotValueSemantics", "testRuntimeResourceValueSemantics"], "kind": "unit"}
      ],
      "docs": ["docs/ethercat-core-api.md"],
      "dependsOn": [],
      "notesZh": ["跨插件只传递此库或 EtherCATCore 的公开合同，不包含其他插件的私有头文件。"]
    },
    {
      "id": "ethercat.core.provider-registry",
      "area": "architecture",
      "titleZh": "Provider 注册与唯一性",
      "summaryZh": "发现公共 Provider、拒绝重复稳定 ID，并以有界诊断报告冲突。",
      "owner": "ethercat-core",
      "runtimeBoundary": "engineering-only",
      "evidenceBoundary": ["unit", "offscreen-ui"],
      "keywords": ["Provider", "注册", "重复 ID", "插件依赖", "内存上限"],
      "implementation": [
        {"path": "src/plugins/ethercatcore/providerregistry.cpp", "symbols": ["ProviderRegistry::handleObjectAdded", "ProviderRegistry::recordDuplicateProvider"], "roleZh": "对象池发现、唯一性和有界诊断"}
      ],
      "contracts": [
        {"path": "src/plugins/ethercatcore/providers.h", "symbols": ["class ETHERCATCORE_EXPORT Provider", "ProviderStartupDiagnostic"], "roleZh": "公共 Provider 基类和启动诊断"}
      ],
      "tests": [
        {"path": "src/plugins/ethercatcore/ethercatcoretests.cpp", "cases": ["testProviderRegistryTracksObjectPool"], "kind": "unit"},
        {"path": "src/plugins/ethercatworkbench/ethercatworkbenchtests.cpp", "cases": ["testProviderStartupDiagnosticsPresentation"], "kind": "offscreen-ui"}
      ],
      "docs": ["docs/ethercat-plugin-development-guide.zh_CN.md"],
      "dependsOn": ["ethercat.data.domain-contracts"],
      "notesZh": ["同一职责只允许一个稳定 Provider ID；冲突对象不会成为备用实现。"]
    },
    {
      "id": "ethercat.core.topology-service",
      "area": "architecture",
      "titleZh": "来源隔离的统一拓扑服务",
      "summaryZh": "按精确来源、Provider 和工程 Scope 即时投影真实或 Mock 拓扑，并派生可比较的 generation 与 freshness。",
      "owner": "ethercat-core",
      "runtimeBoundary": "engineering-only",
      "evidenceBoundary": ["unit"],
      "keywords": ["TopologyService", "拓扑", "Real", "Mock", "generation", "freshness"],
      "implementation": [
        {"path": "src/plugins/ethercatcore/topologyservice.cpp", "symbols": ["TopologyService::topology", "TopologySnapshot::generation", "TopologyService::handleProviderAboutToBeRemoved"], "roleZh": "精确来源查询、代际派生和失效通知"}
      ],
      "contracts": [
        {"path": "src/plugins/ethercatcore/topologyservice.h", "symbols": ["class ETHERCATCORE_EXPORT TopologyService", "TopologySelection", "TopologyGeneration", "TopologyLookupResult", "hasFreshProviderEvidence"], "roleZh": "统一只读拓扑选择、来源、代际和 Provider 质量合同"}
      ],
      "tests": [
        {"path": "src/plugins/ethercatcore/ethercatcoretests.cpp", "cases": ["testTopologyServiceKeepsRealAndMockEvidenceSeparate"], "kind": "unit"}
      ],